{
  "task_id": "TASK-028",
  "title": "Central Message Router (Refactor webhooks.ts)",
  "status": "completed",
  "priority": "high",
  "classification": "Refactor",
  "domain": ["Backend"],
  "created_at": "2026-02-10T00:00:00+05:30",
  "completed_at": "2026-02-10T00:00:00+05:30",
  "goal": "Replace primitive keyword-based routing in webhooks.ts with a central MessageRouter that routes by contact_type.",
  "dependencies": ["TASK-026", "TASK-027"],
  "files_touched": [
    "agents/backend/src/services/message_router.ts",
    "agents/backend/src/routes/webhooks.ts"
  ],
  "result_summary": "Created MessageRouter class with route(contact, message, channel) method. Routes: UNKNOWN->UnknownIdentificationWorkflow, BUYER_TENANT->BuyerWorkflow, SELLER_LANDLORD->SellerWorkflow, PARTNER_AGENT->PartnerAgentWorkflow, MANAGEMENT->placeholder. Refactored webhooks.ts to use messageRouter.route() instead of inline isSellerFn logic. Also added inbound interaction logging and last_interaction timestamp updates."
}
