{
    "task_id": "TASK-008",
    "title": "Implement Frontend Dashboard",
    "status": "completed",
    "result_summary": "Frontend Dashboard implemented with Vite+React. API Client connected to Backend (Port 3002).",
    "files_touched": [
        "agents/frontend/src/App.tsx",
        "agents/frontend/src/components/*",
        "agents/frontend/src/api/*"
    ],
    "priority": "high",
    "classification": "Implementation",
    "domain": [
        "Frontend",
        "Core"
    ],
    "created_at": "2026-02-06T23:05:00+05:30",
    "goal": "Create a web-based dashboard for the Master Inspector (Admin) to view and manage leads.",
    "context": {
        "user_story": "As the Master Inspector, I want to see a list of contacts and their interaction history so that I can intervene if the AI fails.",
        "requirements": "React-based SPA, connect to Backend API, display Contacts list, display Chat history."
    },
    "dependencies": [
        "TASK-004",
        "TASK-007"
    ],
    "sub_tasks": [
        {
            "id": "TASK-008-A",
            "workflow": "Frontend",
            "output": "Initialize Vite + React project in `agents/frontend`."
        },
        {
            "id": "TASK-008-B",
            "workflow": "Frontend",
            "output": "Implement API Client (Axios) to fetch /contacts and /interactions."
        },
        {
            "id": "TASK-008-C",
            "workflow": "Frontend",
            "output": "Build Dashboard UI (Sidebar, Contact List, Chat View)."
        }
    ],
    "decisions": [
        "Use Vite for fast development.",
        "Use Vanilla CSS as per design guidelines.",
        "Keep state management simple (React Context or local state) for V1."
    ],
    "acceptance_criteria": [
        "Project builds and runs locally.",
        "Can view list of contacts from DB.",
        "Can click a contact to view message history."
    ],
    "next_recommended_tasks": [
        "TASK-009"
    ]
}