{
  "task_id": "TASK-085",
  "title": "Security Middleware (Helmet, CORS, Compression)",
  "status": "completed",
  "priority": "critical",
  "classification": "Security",
  "domain": ["Backend", "Security", "Infrastructure"],
  "created_at": "2026-02-12T00:00:00+05:30",
  "completed_at": "2026-02-12T00:00:00+05:30",
  "goal": "Implement production-grade security middleware including Helmet security headers, CORS whitelist validation, and response compression.",
  "dependencies": [],
  "sub_tasks": [
    {
      "id": "TASK-085-1",
      "title": "Add Helmet Security Headers",
      "status": "completed",
      "output": "Configured helmet middleware with Content Security Policy, cross-origin resource policy set to cross-origin"
    },
    {
      "id": "TASK-085-2",
      "title": "Implement CORS Whitelist",
      "status": "completed",
      "output": "Added CORS middleware with origin validation against ALLOWED_ORIGINS environment variable, rejects unauthorized origins"
    },
    {
      "id": "TASK-085-3",
      "title": "Add Response Compression",
      "status": "completed",
      "output": "Integrated compression middleware to reduce response payload size for improved performance"
    }
  ],
  "files_touched": [
    "agents/backend/src/app.ts"
  ],
  "acceptance_criteria": [
    "Helmet security headers configured and active",
    "CORS whitelist enforces allowed origins from environment variable",
    "Response compression enabled for all routes",
    "CSP directives properly configured",
    "Cross-origin resource policy set"
  ],
  "result_summary": "Production-grade security middleware implemented. Helmet provides comprehensive security headers including CSP, CORS validates requests against ALLOWED_ORIGINS whitelist, and compression middleware reduces bandwidth usage. All security best practices followed.",
  "next_recommended_tasks": ["TASK-086"]
}
