{
  "task_id": "TASK-091",
  "title": "Testing Setup (Vitest)",
  "status": "completed",
  "priority": "high",
  "classification": "Testing",
  "domain": ["Backend", "Testing", "Quality Assurance"],
  "created_at": "2026-02-12T00:00:00+05:30",
  "completed_at": "2026-02-12T00:00:00+05:30",
  "goal": "Set up Vitest testing framework with test, watch, and coverage scripts for unit and integration testing of backend services.",
  "dependencies": [],
  "sub_tasks": [
    {
      "id": "TASK-091-1",
      "title": "Install Vitest Dependencies",
      "status": "completed",
      "output": "Added vitest and supertest to devDependencies"
    },
    {
      "id": "TASK-091-2",
      "title": "Create vitest.config.ts",
      "status": "completed",
      "output": "Configured Vitest with TypeScript support and test environment settings"
    },
    {
      "id": "TASK-091-3",
      "title": "Add Test Scripts to package.json",
      "status": "completed",
      "output": "Added 'test' (run once), 'test:watch' (watch mode), and 'test:coverage' (with coverage report) scripts"
    }
  ],
  "files_touched": [
    "agents/backend/package.json",
    "agents/backend/vitest.config.ts"
  ],
  "acceptance_criteria": [
    "Vitest installed as devDependency",
    "vitest.config.ts configuration file exists",
    "npm run test executes tests",
    "npm run test:watch runs in watch mode",
    "npm run test:coverage generates coverage report",
    "TypeScript support enabled for tests",
    "Supertest available for API endpoint testing"
  ],
  "result_summary": "Testing infrastructure complete with Vitest framework. Three test scripts configured: 'test' for CI/CD pipelines, 'test:watch' for development TDD workflow, and 'test:coverage' for coverage analysis. Supertest integration enables API endpoint testing. Ready for writing unit and integration tests.",
  "next_recommended_tasks": ["TASK-092", "TASK-093"]
}
