{
    "task_id": "TASK-014",
    "title": "Implement Inventory Database & Matching Engine",
    "status": "completed",
    "result_summary": "Inventory Model defined, Migration ran, Commit logic updated, matching engine verified.",
    "files_touched": [
        "prisma/schema.prisma",
        "src/services/matching.ts",
        "src/routes/inventory.ts"
    ],
    "priority": "high",
    "classification": "Feature",
    "domain": [
        "Backend",
        "Database"
    ],
    "created_at": "2026-02-07T01:36:00+05:30",
    "goal": "Migrate from text-based inventory logging to a structured SQL table, and implement the logic to match Buyers with available Inventory.",
    "context": {
        "source": "Chat/Chatgpt.txt (Next Step 1)",
        "requirement": "Inventory must be queryable to find matches for Buyers."
    },
    "dependencies": [
        "TASK-001",
        "TASK-013"
    ],
    "sub_tasks": [
        {
            "id": "TASK-014-A",
            "output": "Update schema.prisma with `Inventory` model (Category, Type, Price, Location, Specs)"
        },
        {
            "id": "TASK-014-B",
            "output": "Run Database Migration"
        },
        {
            "id": "TASK-014-C",
            "output": "Update `POST /commit` to write to `Inventory` table"
        },
        {
            "id": "TASK-014-D",
            "output": "Implement `MatchingService` (Input: Buyer Requirements -> Output: List of Inventory)"
        },
        {
            "id": "TASK-014-E",
            "output": "Verify Matching Logic with Script"
        }
    ],
    "acceptance_criteria": [
        "Inventory table exists in Postgres",
        "Onboarding workflow saves to Inventory table",
        "MatchingService correctly returns items based on Budget and Location overlap"
    ]
}