{
  "task_id": "TASK-037",
  "title": "Initialize Next.js Website + Homepage",
  "status": "completed",
  "priority": "high",
  "classification": "Feature",
  "domain": ["Frontend", "Website"],
  "created_at": "2026-02-10T00:00:00+05:30",
  "completed_at": "2026-02-10T00:00:00+05:30",
  "goal": "Create public-facing property website with Next.js 16, Tailwind, Framer Motion. Build animated homepage.",
  "dependencies": [],
  "files_touched": [
    "agents/website/ (new Next.js app)",
    "agents/website/src/app/layout.tsx",
    "agents/website/src/app/page.tsx",
    "agents/website/src/app/globals.css",
    "agents/website/src/components/Navbar.tsx",
    "agents/website/src/components/Hero.tsx",
    "agents/website/src/components/PropertyCard.tsx",
    "agents/website/src/components/StatsCounter.tsx",
    "agents/website/src/components/FeaturedProperties.tsx",
    "agents/website/src/components/CTASection.tsx",
    "agents/website/src/components/Footer.tsx",
    "agents/website/src/lib/api.ts",
    "agents/website/src/lib/utils.ts"
  ],
  "result_summary": "Created Next.js 16 + App Router + TypeScript + Tailwind website. Homepage has: animated Hero with search bar (buy/rent toggle + location input), FeaturedProperties grid with placeholder data, StatsCounter with animated number counting, CTA section for Panditji WhatsApp, responsive Navbar with mobile menu, Footer with quick links. Dark modern theme with Framer Motion animations. Price formatting in INR (Lakh/Crore)."
}
