{
    "task_id": "TASK-010",
    "title": "Implement Orchestration & Scheduler",
    "status": "completed",
    "result_summary": "Implemented Decision Engine & Scheduler. Fallback logic (Missed Call -> WhatsApp) verified.",
    "files_touched": [
        "agents/backend/src/services/scheduler.ts",
        "agents/backend/src/services/decision_engine.ts",
        "agents/backend/src/scripts/test_scheduler.ts"
    ],
    "priority": "high",
    "classification": "Implementation",
    "domain": [
        "Backend",
        "Logic"
    ],
    "created_at": "2026-02-06T23:45:00+05:30",
    "goal": "Implement the Decision Engine and Scheduler for automated follow-ups.",
    "context": {
        "requirement": "Chatgpt.txt Line 134: 'Orchestration Layer', Line 232: 'Scheduler (cron / queue)'",
        "user_story": "As the system, I need to decide when to call vs WhatsApp and schedule future actions."
    },
    "dependencies": [
        "TASK-009"
    ],
    "sub_tasks": [
        {
            "id": "TASK-010-A",
            "output": "Implement cron job service (e.g., node-cron)"
        },
        {
            "id": "TASK-010-B",
            "output": "Implement `DecisionEngine` logic (e.g., failed call -> WhatsApp)"
        },
        {
            "id": "TASK-010-C",
            "output": "Auto-schedule next actions based on `next_action_at` SSOT field"
        }
    ]
}