{
  "task_id": "TASK-093",
  "title": "GitHub Actions CI/CD Pipeline",
  "status": "completed",
  "priority": "high",
  "classification": "DevOps",
  "domain": ["Backend", "CI/CD", "Automation"],
  "created_at": "2026-02-12T00:00:00+05:30",
  "completed_at": "2026-02-12T00:00:00+05:30",
  "goal": "Implement automated CI/CD pipeline using GitHub Actions to run linting, tests, and build verification on every commit and pull request.",
  "dependencies": ["TASK-091"],
  "sub_tasks": [
    {
      "id": "TASK-093-1",
      "title": "Create Backend CI Workflow",
      "status": "completed",
      "output": "Created .github/workflows/backend-ci.yml for backend CI pipeline"
    },
    {
      "id": "TASK-093-2",
      "title": "Configure Lint Job",
      "status": "completed",
      "output": "Added TypeScript linting step to catch code quality issues"
    },
    {
      "id": "TASK-093-3",
      "title": "Configure Test Job",
      "status": "completed",
      "output": "Added Vitest test execution with Node.js 20 LTS"
    },
    {
      "id": "TASK-093-4",
      "title": "Configure Build Job",
      "status": "completed",
      "output": "Added TypeScript compilation check to ensure production build succeeds"
    },
    {
      "id": "TASK-093-5",
      "title": "Set Trigger Conditions",
      "status": "completed",
      "output": "Pipeline triggers on push to main/master and all pull requests"
    }
  ],
  "files_touched": [
    ".github/workflows/backend-ci.yml"
  ],
  "acceptance_criteria": [
    "GitHub Actions workflow file exists",
    "Workflow triggers on push to main/master branches",
    "Workflow triggers on all pull requests",
    "Lint job runs and fails on code quality issues",
    "Test job runs Vitest tests",
    "Build job verifies TypeScript compilation",
    "Node.js 20 LTS used for consistency",
    "Fast feedback loop (< 5 minutes for full pipeline)",
    "Clear job names and status reporting"
  ],
  "result_summary": "Automated CI/CD pipeline operational with GitHub Actions. Every commit and PR automatically runs through lint, test, and build stages. Catches code quality issues, test failures, and build errors before merge. Ensures main branch stability and production readiness. backend-ci.yml workflow provides fast feedback to developers.",
  "next_recommended_tasks": ["TASK-094", "TASK-095"]
}
