{
    "task_id": "TASK-000",
    "title": "Initialize Agent Workflow System",
    "status": "completed",
    "priority": "critical",
    "classification": "System Setup",
    "domain": [
        "Master Inspector",
        "Task Manager"
    ],
    "created_at": "2026-02-06T21:40:00+05:30",
    "completed_at": "2026-02-06T21:45:00+05:30",
    "goal": "Establish the foundational directory structure and protocols for the Agent-based Development Workflow.",
    "context": {
        "project": "Realty Pandit",
        "client": "Sunny Sharma",
        "ssot_scope": "Private Client SSOT"
    },
    "dependencies": [],
    "sub_tasks": [
        {
            "id": "TASK-000-A",
            "workflow": "Master Inspector",
            "output": "Designed directory structure and workflow roles."
        },
        {
            "id": "TASK-000-B",
            "workflow": "Task Manager",
            "output": "Created SCHEMA.json and directory layout."
        }
    ],
    "files_touched": [
        ".agent/workflows/reality-pandit-dev.md",
        "clients/sunny-sharma/projects/reality-pandit/docs/tasks/SCHEMA.json"
    ],
    "decisions": [
        "Adopted file-based memory for Task Manager.",
        "Defined Master Inspector as the central orchestrator."
    ],
    "acceptance_criteria": [
        "Directory structure created.",
        "Schema definition exists."
    ],
    "result_summary": "The Agent Workshop is initialized. Future work will be tracked via TASK-XXX.json files.",
    "next_recommended_tasks": [
        "TASK-001"
    ]
}