{
  "task_id": "TASK-027",
  "title": "Partner Agent System",
  "status": "completed",
  "priority": "high",
  "classification": "Feature",
  "domain": ["Backend", "Database", "AI"],
  "created_at": "2026-02-10T00:00:00+05:30",
  "completed_at": "2026-02-10T00:00:00+05:30",
  "goal": "Create Partner Agent workflow with dual-mode handling for external property dealers.",
  "dependencies": ["TASK-023", "TASK-026"],
  "files_touched": [
    "agents/backend/src/workflows/partner_agent.ts",
    "agents/backend/src/services/system_prompt.ts",
    "agents/backend/prisma/schema.prisma"
  ],
  "result_summary": "Created PartnerAgentWorkflow with two modes: HAS_PROPERTIES (routes to inventory listing) and HAS_BUYERS (collects buyer requirements for matching). PartnerAgent model in schema with phone_number PK, agency_name, partner_type, verified, commission_rate. Added getPartnerAgentPrompt() to SystemPromptService."
}
