{
    "task_id": "TASK-015",
    "title": "Implement Outbound Voice Integration",
    "status": "completed",
    "result_summary": "Added makeOutboundCall to VoiceService with Mock Mode (API Key check). Integrated Trigger into DecisionEngine. Verification script confirmed log entry.",
    "files_touched": [
        "agents/backend/src/services/voice.ts",
        "agents/backend/src/services/decision_engine.ts",
        "agents/backend/src/scripts/test_outbound.ts"
    ],
    "priority": "high",
    "classification": "Feature",
    "domain": [
        "Backend",
        "Voice",
        "API"
    ],
    "created_at": "2026-02-07T01:48:00+05:30",
    "goal": "Enable the system to initiate outbound phone calls via Vapi.ai API (triggered by Decision Engine or Scheduler).",
    "context": {
        "source": "Chat/Chatgpt.txt",
        "requirement": "AI calls new leads automatically (Lines 193)."
    },
    "dependencies": [
        "TASK-009",
        "TASK-010"
    ],
    "sub_tasks": [
        {
            "id": "TASK-015-A",
            "output": "Update `VoiceService` with `makeOutboundCall` method (POST vapi.ai/call)"
        },
        {
            "id": "TASK-015-B",
            "output": "Implement Mock Mode for local development (without real API key)"
        },
        {
            "id": "TASK-015-C",
            "output": "Integrate with `DecisionEngine` to trigger call on new 'hot' lead"
        },
        {
            "id": "TASK-015-D",
            "output": "Verify with `test_outbound.ts`"
        }
    ],
    "acceptance_criteria": [
        "DecisionEngine triggering an action results in a Vapi API call (or Mock log)",
        "Outbound call is logged in `interactions` table",
        "Graceful error handling if API fails"
    ]
}